Link Name,Center of Mass X,Center of Mass Y,Center of Mass Z,Center of Mass Roll,Center of Mass Pitch,Center of Mass Yaw,Mass,Moment Ixx,Moment Ixy,Moment Ixz,Moment Iyy,Moment Iyz,Moment Izz,Visual X,Visual Y,Visual Z,Visual Roll,Visual Pitch,Visual Yaw,Mesh Filename,Color Red,Color Green,Color Blue,Color Alpha,Collision X,Collision Y,Collision Z,Collision Roll,Collision Pitch,Collision Yaw,Collision Mesh Filename,Material Name,SW Components,Coordinate System,Axis Name,Joint Name,Joint Type,Joint Origin X,Joint Origin Y,Joint Origin Z,Joint Origin Roll,Joint Origin Pitch,Joint Origin Yaw,Parent,Joint Axis X,Joint Axis Y,Joint Axis Z,Limit Effort,Limit Velocity,Limit Lower,Limit Upper,Calibration rising,Calibration falling,Dynamics Damping,Dynamics Friction,Safety Soft Upper,Safety Soft Lower,Safety K Position,Safety K Velocity
base_link,0.011667,0.015598,0.13005,0,0,0,19.885,0.17133,5.0814E-06,5.992E-06,0.35448,0.00034947,0.47171,0,0,0,0,0,0,package://Mbot200/meshes/base_link.STL,1,1,1,0.53,0,0,0,0,0,0,package://Mbot200/meshes/base_link.STL,,运动控制卡亚克力板-3;左侧盒-1;AGV外壳后-1;钣金上表面-1;电池-1;AGV外壳黄色部分-1;AGV外壳黄色部分-2;运动控制卡亚克力板-2;AGV中部盒-1;后灯-1;MKS SBase V1.3-1;电源显示-1;MontagemPlug-1;右侧盒-1;电池支座-1;AGV外壳前-1;Frame 支撑块-8;Frame 支撑块-9;Frame 支撑块-7;Frame 支撑块-2;Frame AGV后部承重结构块-2;Frame AGV后部承重结构块后部软胶壳-1;Frame AGV电机支座-1;Frame AGV后部承重结构块-1;Frame AGV车架柱-2;Frame 支撑块-3;Frame AGV电机支座-2;Frame 支撑块-1;Frame AGV后部承重结构块后部软胶壳-3;Frame AGV后部承重结构块后部软胶壳-2;Frame AGV后部承重结构块后部软胶壳-4;Frame AGV车架柱-1,底盘坐标系,,,,0,0,0,0,0,0,,0,0,0,,,,,,,,,,,,
left_front_link,-1.6848E-05,-0.045575,-8.0839E-06,0,0,0,2.3817,0.0025272,-1.156E-08,-4.6688E-08,0.0041408,8.5356E-08,0.0025269,0,0,0,0,0,0,package://Mbot200/meshes/left_front_link.STL,1,1,1,1,0,0,0,0,0,0,package://Mbot200/meshes/left_front_link.STL,,motor电机装配体-2/motor麦克纳姆轮右后-1/motorRoller all-10/motorRoller wanzheng-1/motorRoller kongke-1;motor电机装配体-2/motor麦克纳姆轮右后-1/motorRoller all-5/motorRoller wanzheng-1/motorRoller kongke-1;motor电机装配体-2/motor麦克纳姆轮右后-1/motorRoller all-4/motorRoller wanzheng-1/motorRoller kongke-1;motor电机装配体-2/motor麦克纳姆轮右后-1/motorRoller all-8/motorRoller wanzheng-1/motorRoller kongke-1;motor电机装配体-2/motor麦克纳姆轮右后-1/motorRoller all-12/motorRoller wanzheng-1/motorRoller kongke-1;motor电机装配体-2/motor麦克纳姆轮右后-1/motorRoller all-3/motorRoller wanzheng-1/motorRoller kongke-1;motor电机装配体-2/motor麦克纳姆轮右后-1/motorRoller all-1/motorRoller wanzheng-1/motorRoller kongke-1;motor电机装配体-2/motor麦克纳姆轮右后-1/motorRoller all-2/motorRoller wanzheng-1/motorRoller kongke-1;motor电机装配体-2/motor麦克纳姆轮右后-1/motorRoller all-9/motorRoller wanzheng-1/motorRoller kongke-1;motor电机装配体-2/motor麦克纳姆轮右后-1/motorRoller all-11/motorRoller wanzheng-1/motorRoller kongke-1;motor电机装配体-2/motor麦克纳姆轮右后-1/motorRoller all-6/motorRoller wanzheng-1/motorRoller kongke-1;motor电机装配体-2/motor麦克纳姆轮右后-1/motorRoller all-7/motorRoller wanzheng-1/motorRoller kongke-1;motor电机装配体-2/motor麦克纳姆轮右后-1/motorMecanum Left Wheels ceban finish-2;motor电机装配体-2/motor麦克纳姆轮右后-1/motorWheels yuanzhu-1;motor电机装配体-2/motor麦克纳姆轮右后-1/motorWheels xi yuanzhu-4;motor电机装配体-2/motor麦克纳姆轮右后-1/motorWheels xi yuanzhu-1;motor电机装配体-2/motor麦克纳姆轮右后-1/motorMecanum Left Wheels ceban finish-1;motor电机装配体-2/motor麦克纳姆轮右后-1/motorWheels xi yuanzhu-6;motor电机装配体-2/motor麦克纳姆轮右后-1/motorWheels xi yuanzhu-5;motor电机装配体-2/motor麦克纳姆轮右后-1/motorWheels xi yuanzhu-3;motor电机装配体-2/motor麦克纳姆轮右后-1/motorWheels xi yuanzhu-2;motor电机装配体-2/motor减速箱-1/motorshaft1-1;motor电机装配体-2/motorCoupling轴承座-2,前轮（左）坐标系,前轮基准轴,left_front_link,continuous,0.3,0.27871,0.069,0,0,0,base_link,0,1,0,,,,,,,,,,,,
right_front_link,1.6848E-05,0.045575,-8.0839E-06,0,0,0,2.3817,0.0025272,-1.156E-08,4.6688E-08,0.0041408,-8.5356E-08,0.0025269,0,0,0,0,0,0,package://Mbot200/meshes/right_front_link.STL,1,1,1,1,0,0,0,0,0,0,package://Mbot200/meshes/right_front_link.STL,,motor电机装配体-1/motor麦克纳姆轮右后-1/motorMecanum Left Wheels ceban finish-2;motor电机装配体-1/motor麦克纳姆轮右后-1/motorRoller all-5/motorRoller wanzheng-1/motorRoller kongke-1;motor电机装配体-1/motor麦克纳姆轮右后-1/motorRoller all-4/motorRoller wanzheng-1/motorRoller kongke-1;motor电机装配体-1/motor麦克纳姆轮右后-1/motorRoller all-8/motorRoller wanzheng-1/motorRoller kongke-1;motor电机装配体-1/motor麦克纳姆轮右后-1/motorRoller all-10/motorRoller wanzheng-1/motorRoller kongke-1;motor电机装配体-1/motor麦克纳姆轮右后-1/motorRoller all-7/motorRoller wanzheng-1/motorRoller kongke-1;motor电机装配体-1/motor麦克纳姆轮右后-1/motorRoller all-6/motorRoller wanzheng-1/motorRoller kongke-1;motor电机装配体-1/motor麦克纳姆轮右后-1/motorRoller all-11/motorRoller wanzheng-1/motorRoller kongke-1;motor电机装配体-1/motor麦克纳姆轮右后-1/motorRoller all-9/motorRoller wanzheng-1/motorRoller kongke-1;motor电机装配体-1/motor麦克纳姆轮右后-1/motorRoller all-2/motorRoller wanzheng-1/motorRoller kongke-1;motor电机装配体-1/motor麦克纳姆轮右后-1/motorRoller all-1/motorRoller wanzheng-1/motorRoller kongke-1;motor电机装配体-1/motor麦克纳姆轮右后-1/motorWheels xi yuanzhu-4;motor电机装配体-1/motor麦克纳姆轮右后-1/motorWheels xi yuanzhu-1;motor电机装配体-1/motor麦克纳姆轮右后-1/motorWheels xi yuanzhu-6;motor电机装配体-1/motor麦克纳姆轮右后-1/motorMecanum Left Wheels ceban finish-1;motor电机装配体-1/motor麦克纳姆轮右后-1/motorWheels yuanzhu-1;motor电机装配体-1/motor麦克纳姆轮右后-1/motorWheels xi yuanzhu-2;motor电机装配体-1/motor麦克纳姆轮右后-1/motorWheels xi yuanzhu-5;motor电机装配体-1/motor减速箱-1/motorshaft1-1;motor电机装配体-1/motorCoupling轴承座-2;motor电机装配体-1/motor麦克纳姆轮右后-1/motorRoller all-3/motorRoller wanzheng-1/motorRoller kongke-1;motor电机装配体-1/motor麦克纳姆轮右后-1/motorRoller all-12/motorRoller wanzheng-1/motorRoller kongke-1;motor电机装配体-1/motor麦克纳姆轮右后-1/motorWheels xi yuanzhu-3,前轮（右）坐标系,前轮基准轴,right_front_link,continuous,0.3,-0.27971,0.069,0,0,0,base_link,0,1,0,,,,,,,,,,,,
left_back_link,1.6848E-05,-0.045575,8.0839E-06,0,0,0,2.3817,0.0025272,1.156E-08,-4.6688E-08,0.0041408,-8.5356E-08,0.0025269,0,0,0,0,0,0,package://Mbot200/meshes/left_back_link.STL,1,1,1,1,0,0,0,0,0,0,package://Mbot200/meshes/left_back_link.STL,,motor电机装配体-4/motor麦克纳姆轮右后-1/motorMecanum Left Wheels ceban finish-1;motor电机装配体-4/motor减速箱-1/motorshaft1-1;motor电机装配体-4/motorCoupling轴承座-2;motor电机装配体-4/motor麦克纳姆轮右后-1/motorRoller all-1/motorRoller wanzheng-1/motorRoller kongke-1;motor电机装配体-4/motor麦克纳姆轮右后-1/motorRoller all-2/motorRoller wanzheng-1/motorRoller kongke-1;motor电机装配体-4/motor麦克纳姆轮右后-1/motorRoller all-9/motorRoller wanzheng-1/motorRoller kongke-1;motor电机装配体-4/motor麦克纳姆轮右后-1/motorRoller all-11/motorRoller wanzheng-1/motorRoller kongke-1;motor电机装配体-4/motor麦克纳姆轮右后-1/motorRoller all-6/motorRoller wanzheng-1/motorRoller kongke-1;motor电机装配体-4/motor麦克纳姆轮右后-1/motorRoller all-7/motorRoller wanzheng-1/motorRoller kongke-1;motor电机装配体-4/motor麦克纳姆轮右后-1/motorRoller all-10/motorRoller wanzheng-1/motorRoller kongke-1;motor电机装配体-4/motor麦克纳姆轮右后-1/motorRoller all-5/motorRoller wanzheng-1/motorRoller kongke-1;motor电机装配体-4/motor麦克纳姆轮右后-1/motorRoller all-4/motorRoller wanzheng-1/motorRoller kongke-1;motor电机装配体-4/motor麦克纳姆轮右后-1/motorRoller all-8/motorRoller wanzheng-1/motorRoller kongke-1;motor电机装配体-4/motor麦克纳姆轮右后-1/motorRoller all-12/motorRoller wanzheng-1/motorRoller kongke-1;motor电机装配体-4/motor麦克纳姆轮右后-1/motorRoller all-3/motorRoller wanzheng-1/motorRoller kongke-1;motor电机装配体-4/motor麦克纳姆轮右后-1/motorMecanum Left Wheels ceban finish-2;motor电机装配体-4/motor麦克纳姆轮右后-1/motorWheels xi yuanzhu-3;motor电机装配体-4/motor麦克纳姆轮右后-1/motorWheels yuanzhu-1;motor电机装配体-4/motor麦克纳姆轮右后-1/motorWheels xi yuanzhu-2;motor电机装配体-4/motor麦克纳姆轮右后-1/motorWheels xi yuanzhu-1;motor电机装配体-4/motor麦克纳姆轮右后-1/motorWheels xi yuanzhu-4;motor电机装配体-4/motor麦克纳姆轮右后-1/motorWheels xi yuanzhu-6;motor电机装配体-4/motor麦克纳姆轮右后-1/motorWheels xi yuanzhu-5,后轮（左）坐标系,后轮基准轴,left_back_joint,continuous,-0.29,0.27871,0.069,0,0,0,base_link,0,1,0,,,,,,,,,,,,
right_back_link,-1.6848E-05,0.045575,8.0839E-06,0,0,0,2.3817,0.0025272,1.156E-08,4.6688E-08,0.0041408,8.5356E-08,0.0025269,0,0,0,0,0,0,package://Mbot200/meshes/right_back_link.STL,1,1,1,1,0,0,0,0,0,0,package://Mbot200/meshes/right_back_link.STL,,motor电机装配体-3/motor减速箱-1/motorshaft1-1;motor电机装配体-3/motorCoupling轴承座-2;motor电机装配体-3/motor麦克纳姆轮右后-1/motorRoller all-1/motorRoller wanzheng-1/motorRoller kongke-1;motor电机装配体-3/motor麦克纳姆轮右后-1/motorRoller all-2/motorRoller wanzheng-1/motorRoller kongke-1;motor电机装配体-3/motor麦克纳姆轮右后-1/motorRoller all-9/motorRoller wanzheng-1/motorRoller kongke-1;motor电机装配体-3/motor麦克纳姆轮右后-1/motorRoller all-11/motorRoller wanzheng-1/motorRoller kongke-1;motor电机装配体-3/motor麦克纳姆轮右后-1/motorRoller all-6/motorRoller wanzheng-1/motorRoller kongke-1;motor电机装配体-3/motor麦克纳姆轮右后-1/motorRoller all-10/motorRoller wanzheng-1/motorRoller kongke-1;motor电机装配体-3/motor麦克纳姆轮右后-1/motorRoller all-7/motorRoller wanzheng-1/motorRoller kongke-1;motor电机装配体-3/motor麦克纳姆轮右后-1/motorRoller all-5/motorRoller wanzheng-1/motorRoller kongke-1;motor电机装配体-3/motor麦克纳姆轮右后-1/motorMecanum Left Wheels ceban finish-2;motor电机装配体-3/motor麦克纳姆轮右后-1/motorRoller all-8/motorRoller wanzheng-1/motorRoller kongke-1;motor电机装配体-3/motor麦克纳姆轮右后-1/motorRoller all-12/motorRoller wanzheng-1/motorRoller kongke-1;motor电机装配体-3/motor麦克纳姆轮右后-1/motorRoller all-3/motorRoller wanzheng-1/motorRoller kongke-1;motor电机装配体-3/motor麦克纳姆轮右后-1/motorRoller all-4/motorRoller wanzheng-1/motorRoller kongke-1;motor电机装配体-3/motor麦克纳姆轮右后-1/motorMecanum Left Wheels ceban finish-1;motor电机装配体-3/motor麦克纳姆轮右后-1/motorWheels xi yuanzhu-2;motor电机装配体-3/motor麦克纳姆轮右后-1/motorWheels yuanzhu-1;motor电机装配体-3/motor麦克纳姆轮右后-1/motorWheels xi yuanzhu-1;motor电机装配体-3/motor麦克纳姆轮右后-1/motorWheels xi yuanzhu-4;motor电机装配体-3/motor麦克纳姆轮右后-1/motorWheels xi yuanzhu-3;motor电机装配体-3/motor麦克纳姆轮右后-1/motorWheels xi yuanzhu-5;motor电机装配体-3/motor麦克纳姆轮右后-1/motorWheels xi yuanzhu-6,后轮（右）坐标系,后轮基准轴,right_back_joint,continuous,-0.29,-0.27971,0.069,0,0,0,base_link,0,1,0,,,,,,,,,,,,
laser,0.0067655,9.2326E-05,0.020336,0,0,0,1.325,0.00060833,8.0186E-07,-0.00015821,0.00095046,-3.1034E-06,0.0010877,0,0,0,0,0,0,package://Mbot200/meshes/laser.STL,1,1,1,1,0,0,0,0,0,0,package://Mbot200/meshes/laser.STL,,Lidar-2,激光雷达坐标系,,laser,fixed,0.30027,-0.023286,0.25485,0,0,0,base_link,0,0,0,,,,,,,,,,,,
imu,0,0,0,0,0,0,0,0,0,0,0,0,0,0,0,0,0,0,0,package://Mbot200/meshes/imu.STL,1,1,1,1,0,0,0,0,0,0,package://Mbot200/meshes/imu.STL,,IMU-1,IMU坐标系,,imu,fixed,-0.13123,-0.035236,0.236,0,0,0,base_link,0,0,0,,,,,,,,,,,,
